question,answer,wrong1,wrong2,wrong3
"How many protons, electrons and neutrons are present in the element ²¹X⁴³ ?","22, 21, 21","21, 21, 22","22, 22, 22","22, 21, 22"
Atomic no. of Arsenic is 33. What will be the electronic configuration of outermost shell?,"4s² ,4p³","4s² , 4p¹","4s² , 4p²","4s² , 4p⁴"
The electron in an atom,Moves around its nucleus in definite energy level,Moves randomly around the nucleus,Has fixed space around the nucleus,Is stationary in various energy levels
Which of the following set of quantum no. is not possible?,"n=2 , l=2 , m=+1 , s=-1/2","n=2 , l= 1 , m=0 , s=+1/2","n=2 , l=1 , m=-1 , s=+1/2","n=2 , l=1 , m=0 , s=-1/2"
Which of the following does not belong to 3d series?,Pd,Sc,Ti,Fe
Which is correct?,An orbit with principle quantum number n = 3 has 9 orbitals,When 25 gm solute saturates 100 gm water solubility is 25 gm,Carbylamine rxn is shown by 2⁰ amine only,Benzaldehyde doesn't show Cannizaro's reaction
Iron has atomic number 26. What is the electronic configuration of iron cation which can form the complex [Fe(CN)6\(]^{4-}\)?Ar= 1s² 2s² 2p⁶ 3s² 3p⁶,[Ar] 3d⁶ 4s⁰,[Ar] 3d² 4s²,[Ar] 3d⁴ 4s²,[Ar] 3d⁵ 4s⁰
Which one of the following statements is not correct?,The electronic configuration of carbon atom is 1s² 2s² 2px²,"2px , 2py and 2pz electron orbitals are in the same energy states",A 2s electron is in lower energy state than a 2p electron,The energy level of a 3d electron is higher than 4s electron
Magnetic quantum no. of an atom gives,Orientation of electrons in space,Principal shell occupied by \(e^{-}\)s,+ve and -ve spin of \(e^{-}\),Orbital of \(e^{-}\)
Which of the following sequence is correct if given elements are arranged according to ascending atomic no.?,"Fe, Co, Ni, Cu","Co, Fe, Ni, Cu","Fe, Ni, Co, Cu","Cu, Fe, Co, Ni"
The energy of electron in n Bohr's orbit in the hydrogen atom is given by,-2π²Z²e⁴m/n²h²,-2π²m⁴e²Z²/n²h²,-n²h²/2πZ²me⁴,-2πm²e²Z⁴/n²h²
Which of the following electron denoted by the following quantum no. has the highest energy?,"4.2,-1,-1/2","3. 2. 1, 1/2","3, 1.0.-1/2","5, 0, 0, 1/2"
"If 75% of substance decay in 32 minutes then, find how much time it will take to decay 50% of same substance",16 min,10 min,80 min,64 min
"The half life of a radioactive substance is 2 months, then the amount of substance left in 1 year is",M/64,M/32,M/16,M/8
Concept of quantization of energy was introduced by,Bohr,Sommerfeld,Dalton,Heisenburg
Atomic orbitals are filled up in the ground state in order of the increasing energy level. This is the statement of.........,Aufbau principle,Pauli's exclusion principle,Hund's rule,de-Broglie's hypothesis
"In any given orbit electron fill up in increasing order of energy, it is known as",Aufbau principle,Pauli's exclusion principle,Hund's rule,Uncertainty principle
Equal volume of all gases at same temperature and pressure has equal number of molecules is the statement of,Avogadro's law,Dalton's law,Berzelius hypothesis,Charle's law
An orbital have azimuthal quantum no l= 1. The Shape of orbital is,Dumb-bell,Spherical,Double dumb bell,None
"DDT on exposure to water decomposes, It's half life is 10 years. How much time will it take for its 90% decomposition?",40 years,70 years,500 years,700 years
"The configuration Is², 2s² 2p⁵ shows",Ground state of fluorine,Excited state of nitrogen ion,Excited state of oxygen ion,Excited state of fluorine
"The half life of a radioactive isotope is 10 hours, how much of its reactivity will remain after 30 hours?",1/8,1/4,1/3,1/2
The splitting of line into group under the effect of magnetic field is,Zeeman effect,Stark effect,Compton effect,Pressure effect
Shape of orbital is given by the.......Quantum number,Azimuthal,Principal,Magnetic,Spin
"The increasing order for the values of e/m for electron, proton, neutron and α-particle is","n , α , p , e","e , p , n , α","n , p , α , e","n , p , e , α"
Maximum no. of orbitals in a shell is given by,n²,2n²,(2n+1),(n+1)
Which of the following shows highest magnetic moment?,\(Fe^{3+}\),\(V^{3+}\),\(Cr^{3+}\),\(Co^{3+}\)
An electron jumps from higher orbit to lower orbit. Then energy of electron,Decreases,Increases,Remains constant,First increases then decreases
"Half life of a radioactive substance is 1060 years, what is its average life?",1530 year,1460 year,1510 year,1410 year
The silicon atom has unpaired electrons which is due to,Hund's rule,Pauli's exclusion principle,Aufbau principle,Bohr's principle
In sun the source of energy is,Fusion of hydrogen atom,Fusion of heavy nuclei,Fission of heavy nuclei,Fission of uranium atom
Which of the following configuration correspond to alkaline earth metal?,[Ar] 4s²,[Ne] 3s² 3p²,[Ar] 3d¹⁰ 4s¹,[Ar] 3d¹⁰ 4s⁰
Which is not true about cathode rays?,Move with speed same as that of light,A stream of electrons,Charged particles,Can be deflected by magnetic field
Neutron was discovered by,Chadwick,Rutherford,Langmuir,Austin
Neutron is a fundamental particle carrying,no charge and a mass of 1 unit,a charge of +1 and a mass of 1 unit,no charge and no mass,a charge of-1 and a mass of 1 unit
The increasing order for the values of e/m (charge/mass) is,"п, α , р , e","e, p, n, α","n, p, e, α","n, p , α , e"
The heaviest particle is,neutron,meson,electron,proton
"When α-particles are sent through a thin metal foil, most of them go straight through the foil because",Most part of the atom is empty space,α-Particles are lighter than electrons,α-Particles are positively charged,α-Particles move with high velocity
Rutherford's α-particle dispersion experiment concludes,all positive ions are deposited at small part,all negative ions are deposited at small part,proton moves around the electron,neutrons are charged particles
Rutherford's scattering experiment is related to the size of the,Nucleus,Atom,Electron,Neutron
The size of nucleus is,\(10^{-15} m\),\(10^{-12} m\),\(10^{-8} m\),\(10^{-10} m\)
"For principle quantum number n =4, the total number of orbitals having l = 3 is",7,3,5,9
Atomic number of an element indicates,the number of protons in the nucleus,the number of electrons in the nucleus,the number of neutrons in the nucleus,valency of an element
What do you mean by degenerate orbitals?,Orbitals having equal energy,Orbitals having equal wave function,Orbitals having equal energy but different wave function,Orbitals having equal energy and equal wave function
In a given atom no two electrons can have the same values for all the four quantum numbers. This is called,Pauli's Exclusion principle,Hund's Rule,Aufbau principle,Uncertainty principle
It is impossible to know simultaneously the position and momentum of a moving particle with absolute exactness at any instant. This is known as,Heisenberg uncertainty principle,Aufbau principle,Hund's rule,Pauli's exclusion principle.
According to uncertainty principle,△x × △p = h/4π,E = mc²,λ = h/p,△x × △p = h/6π
Which of the following expressions gives the de Broglie relationship?,λ = h/mv,h/mv = p,λ = h/mp,λ = v/p
The uncertainty principle and the concept of wave nature was proposed by......and.....respectively,"Heisenberg, de Broglie","de Broglie, Heisenberg","Heisenberg, Planck","Planck, Heisenberg"
"Number of unpaired electrons in the electronic configuration Is², 2s² 2p⁴ is",2,3,4,6
The correct ground state electronic configuration of chromium atom (At. No.= 24) is,[Ar] 3d⁵ 4s¹,[Ar] 3d⁴ 4s²,[Ar] 3d⁶ 4s⁰,[Ar] 4d⁵ 4s¹
The number of nodal planes 'd' orbital has,2,1,3,0
"Principal, azimuthal and the magnetic quantum numbers are respectively related to","Size, shape and orientation","Shape, size and orientation","Size, orientation and shape",None of the above
The two electrons in an orbital have different,Spin quantum number,Principal quantum number,Azimuthal quantum number,Magnetic quantum number
The two electrons in K shell will differ in,spin quantum number,principal quantum number,azimuthal quantum number,magnetic quantum number
The order of increasing energies of the orbitals follows,5p < 6s < 4f < 5d,5p < 4f < 6s < 5d,4f < 5p < 5d  < 6s,5p < 5d < 4f < 6s
Which one of the following set of quantum numbers is not possible for 4p electron?,"n=4 , l=1 , m=2 , s=+1/2","n=4 , l=1 , m=-1 ,  s=+1/2","n=4 , l=1 , m=0 , s=+1/2","n=4 , l=1 , m=-1 , s=-1/2"
From the given sets of quantum numbers the one that is inconsistent with the theory is,"n=3 , l=2 , m=-3 , s=+1/2","n=4 , l=3 , m=3 , s=+1/2","n=2 , l=1 , m=0 , s=-1/2","n=4 , l=3 , m=2 , s=+1/2"
For which of the following species Bohr's theory is not applicable?,\(He^{2+}\),\(Be^{3+}\),\(Li^{2+}\),H
Line spectra is characteristic of,Atoms,Molecules,Radicals,None
"Of the following, the electromagnetic radiation with maximum wavelength is",Radiowaves,Ultraviolet,X-ray,Infrared
Maximum number of electrons in any orbit is,2n²,n²,(1/2) n²,none of these
,20,19,18,40
A p-orbital can accommodate,2 electrons with opposite spins,4 electrons,6 electrons,2 electrons with parallel spins
The maximum number of electrons in f-subshell is,14,2,8,32
An electron has principal quantum number 3. The number of its (i) sub-shells and (ii) orbitals would be respectively,3 and 9,3 and 5,3 and 7,2 and 5
The ratio of energy of a photon of 2000 Å wavelength radiation to that of 4000 Å radiation is,2,1/4,4,1/2
The total number of orbitals possible for the quantum number n is,n²,n,2n,2n²
"For azimuthal quantum number l= 3, the maximum number of electrons will be",14,2,6,0
"If the radius of first Bohr orbit be 'r' , then the radius of the third orbit would be",9 x r,3 x r,6 x r,1/9 × r
Which of the following transitions of electrons in the hydrogen atom will emit maximum energy?,n3 → n2,n5 → n4,n4 → n3,All will emit same energy
The principle which gives a way to fill the electrons in the available energy levels is,Aufbau principle,Hund's rule,Pauli's exclusion principle,None of these
"The number of unpaired electrons in a chromium ion, \(Cr^{3+}\) (atomic number 24) is",3,6,4,1
The first emission line of hydrogen atomic spectrum in the Balmer series appears at (R = Rydberg constant),(5/36)R \(cm^{-1}\),(3/4)R \(cm^{-1}\),(7/144)R \(cm^{-1}\),(9/400)R \(cm^{-1}\)
"When an electron jumps from lower to higher orbit, the energy",increases,decreases,remains the same,not definite
Which of the following electron transitions will require the largest amount of energy in a hydrogen atom?,from n=1 to n=2,from n=2 to n=3,from n=∞ to n=1,from n=3 to n=5
Which of the following electron transitions will require the largest amount of energy in a hydrogen atom?,from n=1 to n=2,from n=2 to n=3,from n=∞ to n=1,from n=3 to n=5
Different lines in Lyman series of hydrogen spectrum lies in,ultraviolet,infrared,visible,far infrared
The spectrum of He is expected to be similar to that of,\(Li^{+}\),Na,H,\(He^{+}\)
Spectrum produced due to transition of an electron from M to L shell is,emission,absorption,X-rays,continuous
Energy of atomic orbitals in a particular shell is in the order,s<p<d<f,s>p>d>f,p<d<f<s,f>d>s>p
Which of the following represents the correct sets of the four quantum numbers of a 4d electron ?,"4 , 2 , 1 , -1/2","4 , 3 , 2 , +1/2","4 , 2 , 1 , 0","4 , 3 , -2 , +1/2"
Which of the following relates to photons both as wave motion and as a stream of particles?,E=hv,Interference,E=mc²,Diffraction
The electronic configuration of \(Fe^{3+}\) ion is,[Ar] 3d⁵,[Ar] 3d⁶,[Ar] 3d⁴,[Ar] 3d⁰ 4s²
"If electron, hydrogen, helium and neon nuclei are all moving with the velocity of light, then the wavelengths associated with these particles are in the order",Electron > hydrogen > helium > neon,Electron > helium > hydrogen > neon,Electron < hydrogen < helium < neon,Neon < hydrogen < helium < electron
Which of the following series of lines is found in UV region of the atomic spectrum of hydrogen?,Lyman series,Balmer series,Paschen series,Brackett series
The maximum number of electrons in a subshell is given by the expression,4l + 2,4l - 2,2l + 1,2n²
The energy of the electron in the hydrogen atom is given by the expression,–(2π²z²K²e⁴m)/n²h²,–e²/z²,–n²h²/(2π²z²e⁴m),nh/2π
Energy of third orbit of Bohr's atom is,-1.5 eV,-13.6 eV,-3.4 eV,None of the three
"If the speed of electron in the Bohr's first orbit of hydrogen atom be x, then speed of the electron in the 3rd orbit is",x/3,x/9,3x,9x
In hydrogen atom radius of nth orbit is given by,m²,m,r/n,r²n²
The energy of an electron in nth orbit of hydrogen atom is,(-13.6/n²) eV,(13.6/n⁴) eV,(13.6/n³) eV,(13.6/n) eV
According to Bohr's theory the angular momentum for an electron of 5th orbit is,2.5h/π,5h/π,2.5h/2π,6h/2π
Potential energy of \(Li^{2+}\) electron is,-3e²/4πε0r,3e²/4πε0r,-2e²/4πε0r²,-e²/4πε0r
The orbital angular momentum for an electron revolving in an orbital is given by h/2π[√l(l+1)] Thus momentum for an electron in 2s orbital is,zero,+1/2 . h/2π,h/2π,√2 . h/2π
"For d-electron, the orbital angular momentum is",√6h/2π,√2h/2π,h/2π,2h/π
"The third line of the Balmer series, in the emission spectrum of the hydrogen atom, is due to the transition from the",fifth Bohr orbit to the second Bohr orbit,fourth Bohr orbit to the first Bohr orbit,sixth Bohr orbit to the third Bohr orbit,sixth Bohr orbit to the second Bohr orbit
"Which of the following elements, outermost orbital's last electron has magnetic number (m) =0 ?",Na,O,Cl,N
"As the nuclear charge increases from neon to calcium, the orbital energy",increases very rapidly,decreases,increases very slowly,all of the above
Which of the following is not possible?,"n=2 , l=0 , m =-1","n=3 , l=0 , m=0","n=3 , l=1 , m = -1","n=2 , l=1 , m=0"
"According to Bohr's theory of hydrogen atom, which of the following is quantised for an electron ?",Angular momentum,Angular acceleration,Velocity,Acceleration
Wavelength associated with electron motion,decreases with increase in speed of electron,increases with increase in speed of electron,remains same irrespective of speed of electron,is zero
Ratio of energy of a photon of wavelength 3000 Å and 6000 Å is,2:1,3:1,1:2,1:3
The value of the energy for the first excited state of hydrogen atom will be,-3.40 eV,-13.6 eV,-1.51 eV,-0.85 eV
"In a hydrogen atom, if the energy of an electron in the ground state is 13.6 eV, then that in the second excited state is",1.51 eV,3.4 eV,6.04 eV,13.6 eV
"In a hydrogen atom if energy of the first excited state is -3.4 eV, then the KE of the same orbit of hydrogen atom will be",+3.4 eV,+6.8 eV,-13.6 eV,+13.6 eV
"An orbital, in which n = 4, l= 2 is expressed as",4d,4p,4f,3d
The quantum of light energy is,photon,neutron,electron,proton
The orientation of an atomic orbital is governed by,Magnetic quantum number,Spin quantum number,Principal quantum number,Azimuthal quantum number
Which of the following is highly paramagnetic?,\(Mn^{+}\),\(Fe^{2+}\),\(Fe^{3+}\),\(Ni^{2+}\)
The orbital angular momentum of an electron revolving in a p-orbital is,h/√2π,zero,h/2π,1/2 . h/2π
The radius of hydrogen atom in the ground state is 0.53Å. The radius of \(Li^{2+}\) ion (Atomic number=3) in a similar state is,0.176Å,0.53Å,0.30 Å,1.25Å
The ratio of radii of 1st three Bohr orbit in H-atom is,1:4:9,1 : 1/2 : 1/3,1:2:3,1:8:27
Which of the following has maximum magnetic moment,\(Mn^{2+}\),\(Fe^{2+}\),\(Ti^{2+}\),\(Cr^{2+}\)
De-Broglie wave equation treats electron as:,both,Particle,wave,none
Velocity of an electron on nth orbit of an atom of atomic no. Z is proportional to:,Z/n,Z²/n²,n²/Z,Z³/n³
No. of electrons that can be accommodated in dxy orbital is:,2,10,4,1
Bohr's model of an atom is based on,Plank's quantum theory,Heisenberg uncertainty principle,de-Broglie concept of dual character of matter,Schrodinger wave equation
Atomic number represents the number of,Proton,Electron,Neutron,Proton and electron
Rutherford's alpha particles scattering experiment eventually led to the conclusion that,Electrons occupy space around the nucleus,Mass and energy are related,Neutrons are burried deep in nucleus,The point of impact with matter can be precisely determined
