question,answer,wrong1,wrong2,wrong3
Which of the following is heterocyclic aromatic species?,,,,
Which of the following is homocyclic aromatic compound?,Anthracene,Benzene hexachloride,Cyclohexene,Furan
Which of the following is not an aromatic species?,Cyclo octatetraene,Tropylium cation,Cyclopentadienyl anion,Benzene
Which compound amongst the following is not an aromatic compound?,,,,
The structural formula of cyclohexyl alcohol is,,,,
"Consider the following compounds/species

The number of compounds/species which obey Huckel's rule is",4,6,2,5
