question,answer,wrong1,wrong2,wrong3
"R and P can do a piece of work in 12 days, while P alone can finish it in 30 days. R alone can finish the work in ?",20 days,3 days,10days,15 days
A can do a piece of work in 9days. While B can do it in 12 days. A and B together can do the same work in:,36/7,37/7,43/7,44/7
"Nischay, Abhisek and Robin can complete a work in 30, 36, 45 days respectively. They started the work together but after 8 days abhisek left due to his abroad meeting. In how many days remaining work finished?",6,5,12,20
"Two tap A and B fill a tank in 10 hour and 8 hour respectively.  If both the tap are opened simultaneously, then how many hour before tap B should be closed so that tank fill in 5 hours ?",4 hr,2 hr,1 hr,5 hr
"A does half as much work as B in three fourth of the time. If together they take 18 days to complete the work, how much time shall B take to do it?",30,35,40,45
A is 30% more efficient than B. How much time will they working together take to complete a job which A alone could have done in 23 days?,13,11,12,19
A and B can together can do a piece of work in 6 days and A alone can do it in 9 days. The number of days B will take to do it alone is:,18,20,22,24
A can do a piece of work in 10 days and B in 20 days. They begin together but A leaves 2 days before the completion of work. The whole work will be done in,8,5,6,15
"A and B can do a piece of work in 18 days. 
B and C can do it in 24 days. A and C can 
do it in 36 days. Find the time in which A, 
B and C, working together can finish 
work.",16,64,60,70
