question,answer,wrong1,wrong2,wrong3
Green house effect is due to the presence of:,Co2 layer in the atmosphere,Ozone layer in the atmosphere,Infra red light reaching the earth,Moisture layer in the atmosphere
Which of the following is best indicator of SO2 pollution?,Lichens,Pinus,Ferns,Algae
Carbon monoxide is a major pollutant of:,Air,Water,Noise,Soil
Minamata disease was caused by:,Mercury,Lead,Cyanide,Cadmium
BOD stands for:,Biochemical oxygen demand,Chemical oxygen demand,Growing algae in large tanks,Biotic community
"In a polluted lake, the index of pollution is:",Daphnia,Frog,Artemia,None
DDT is an:,Non-biodegradable pollutant,Antibiotic,Biodegradable pollutant,None
Spraying of DDT on crops produces pollution of:,"Air, soil and water only",Air only,Air and soil only,Air and water only
The main causative factor of desertification is:,Overgrazing,Human development activities,Agriculture,Tourism
Green house effect is concerned with:,Global warming,Ozone depletion,Cultivation in kitchen garden,Increased growth of algae
Which of the following pollutant forms a toxic and stable substance in blood by combining with haemoglobin?,CO,CO2,CH4,O2
Ultraviolet radiation from sunlight causes the reaction that produces:,Ozone,CO,SO2,Fluoride
Removal of the soil by the action of wind and water is known as:,Erosion,Fossilization,Calcification,Salination
Eutrophication results in the reduction of:,Dissolved oxygen,Dissolved hydrogen,Mineral salts,None
Grazing is an example of:,Negative pollution,Gully erosion,Positive pollution,Sheet erosion
Herbicide DMCU kills weeds by:,Inhibiting CO2 uptake,Inhibiting respiration,Inhibiting cell division,Inhibiting NO3 uptake
Vulnerable species:,May become endangered,Is in danger of extinction,Is rare to be found,Is an endangered species
Ozone layer is disturbed by:,Supersonic jets,Large number of automobiles,Large number of factories,None
Major aerosol pollutant present in the jet plane emission is:,Fluorocarbon,Sulphur dioxide,Carbon tetrachloride,Carbon monoxide
Musk deer is prime habitat of:,Rara N.P,Sagarmatha N.P,Langtang N.P,Dhorpatan N.P
Red panda is found in:,Langtang N.P,Sagarmatha N.P,Rara N.P,Dhorpatan N.P
One horned rhinoceros and gharial are characteristic of:,Royal Chitwan N.P.,Royal Bardiya N.P.,Both,None
Acid rain contains:,"So2, No2",NO3,O3,CO
Which of the following is not a general pollutant of atmosphere?,CO2,SO2,SO3,Hydrocarbons
The smallest national park of Nepal is:,Rara National Park,Khaptad National Park,Langtang National Park,Royal Chitwan National Park
Air pollution is caused by:,All,Automobile exhausts,Radioactive substance,Smoke
According to 1973 act how many species of birds are endangered?,9,27,3,10
Pollution may be defined as:,Presence of undesirable or toxic materials in the environment,Removal of top soil,Conservation of energy,All
Snow leopard is:,Endangered,Rare,Extinct,Vulnerable
Major air pollutant is:,CO,CO2,N2,Sulphur
Endangered species according to 1973 act of government of Nepal is:,Swamp deer,Red deer,Spotted deer,Hog deer
Which of the following serves as a source of carbon to plants?,Atmospheric CO2,CO2 of carbonate rocks,Fossil fuel,All
Rhododendron forest is found in:,Sub alpine zone,Tropical zone,Sub tropical zone,Temperate zone
Oak is mainly found in:,Temperate zone,Tropical zone,Sub tropical zone,Alpine zone
Shores robusta is found in:,Tropical zone,Subtropical zone,Temperate zone,Alpine zone
Zone of atmosphere that lies near the ground is:,Troposphere,Stratosphere,Homosphere,All
Wild life is destroyed most by:,Destruction of natural habitats,Lack of proper care,Mass scale hunting,Natural calamity
In which of the following biomes maximum number of plants and animals are found ?,Tropical rain forest,Deserts,Tundra,Temperate forest
The threatened species refers to:,All,Endangered,Vulnerable,Rare
Largest terrestrial biome is:,Taiga,Tundra,Savannah,Desert
The population of the following is at risk:,Rare,Endangered,Vulnerable,Extinct
The treeless biomes include:,All,Grassland,Tundra,Deserts
Most priority should be given to the following category of species:,Endangered,Rare,Vulnerable,Extinct
A tropical grassland with scattered trees or shrubs:,Savannah,Taiga,Tundra,None
Red data book provides data on:,Endangered plants and animals,Red eyed birds,Red flowered plants,Red colored fishes
"The biome which is characterized by broad leafed vegetation, for resistant resinous plants and drought evading plants is known as:",Chaparral,Savannah,Steppes,Deciduous forest
Sal forest is:,Deciduous forest,Temperate forest,Evergreen forest,All
What determines the limit of biome?,Altitude and latitude,Types of soil and presence of barrier,Temperate and rainfall,All
Alpine plant shows:,Xerophytism,Mesophytism,Halophytism,Commensalism
A biome is:,Sum of ecosystems in a geographical area,Sum of all ecosystem on the earth,Biotic component in a population,Biotic component in a ecosystem
Tropical rain forest has more:,Angiosperms,Gymnosperm,Both,None
Halophytes are peculiar in having:,Vivipary,Saline soil,Velamen tissue,Pneumatophores
"Avicennia, Rhizohora and Atriplex are:",Halophytes,Xerophytes,Hydrophytes,Mesophytes
Eichhornia is:,Hydrohyte,Xerophyte,Mesophyte,Parasite
A plant living for a few days is:,Ephemeral,Annual,Biennial,Perennial
Mechanical tissue is undeveloped in:,Hydrophytes,Xerophyte,Halophytes,Mesophytes
Desert plant tolerate water stressbby forming:,Leaf like stem modification,Deep roots,No stomata,Stipular spines
Organisms found at the bottom of the seas are:,Lenthos,Planktons,Nektons,Phytons
The more abundant animals in a desert grassland are:,Fossorial,Arboreal,Diurnal,Aquatic
Ecosystem represented by a pond is said to be:,Lentic,Lotic,Xeric,Benthic
Ephemerals are:,Drought escaping,Drought resisting,Drought enduring,All
The tiny free swimming animals on the surface of water constitute:,Zooplankton,Phytoplankton,Symbionts,Benthos
Sunken stomata occurs in:,Xerophyte,Hydrophytes,Hygrophytes,Mesophytes
A plant which is partially submerged and fixed in mud is:,Typha,Cyperus,Eichhornia,Marsilea
Mechanical tissue is well developed in:,Xerophyte,Hydrophytes,Hygrophytes,Mesophyte
Submerged hydrophytes have dissected leaves for:,Reducing effect of water currents,Decreasing surface area,Increasing surface area,Increasing number of stomata
Which one is xerophyte?,Capparis,Lotus,China rose,Casuarina
Excessive aerenchyma is characteristics feature of:,Hydrophytes,Heliophytes,Xerophytes,Mesophytes
"In an aqueous ecosystem, microscopic animals and plant are collectively known as:",Plankton,Herbivore,Commensals,Flora and fauna
Shallow lakes with abundant organic matter are:,Eutrophic,Saprotrophic,Oligotrophic,Heterotrophic
The floating leaves of an aquatic plants have:,Stomata in upper surface,Stomata on lower surface,Stomata on both surfaces,No stomata
Ecology term was coined by:,Haeckel,Reiter,Odum,Linnaeus
Father of ecology is:,Reiter,Aristotle,Linneaus,Odum
Root cap is absent in:,Hydrophytes,Xerophyte,Mesophytes,Halophytes
Ecological pyramid was given by:,Elton,Odum,Haeckel,Reiter
Intermediate communities of succession are:,Sereal community,Pioneer community,Climax community,None
The relationship between producers and consumers in an ecosystem can be understand by:,Ecological pyramid,Food chain,Ecological niche,Food web
Primary succession on rocks start with:,Lichens,Herbs,Animals,Trees
The net plant productivity during photosynthesis is:,1%,10%,5%,2%
Highest productivity is shown by:,Coral reefs,Sugarcane fields,Tropical forests,Ocean
The biological sequence in an ecosystem is:,Producer-consumer-reducer,Producer-reducer-consumer,Reducer-producer-consumer,Consumer-producer-reducer
A community that starts the process of succession in a habitat is called:,Pioneer community,Sereal comment,Climax community,Ecotonal community
Whale fish is:,Secondary consumer,Producer,Decomposer,Primary consumer
Series of changes on previously barren area is:,Primary succession,Sere,Climax community,Secondary succession
Pyramid of biomass is inverted in:,Pond,Tree,Ocean,Grassland
Trophic level of lion in a forest ecosystem is:,T4,T3,T2,T1
Most of energy is present in:,Producers,Herbivores,Carnivore,Tertiary consumer
Energy stored in an ecosystem is given by:,Pyramid of biomass,Pyramid of energy,Pyramid of number,None
Decomposers are:,Organotrophs,Heterotrophs,Autotrophs,Autoheterotrophs
Green plants constitute:,First trophic level,Second trophic level,Third trophic level,Fourth trophic level
Ecological pyramid which is never inverted:,Pyramid of energy,Pyramid of biomass,Pyramid of number,All
Amount of energy transferred from one trophic level to next is:,10%,1.5%,15%,20%
Detritius food chain starts with:,Bacteria,Algae,Protozoa,Virus
Most stable ecosystem is:,Ocean,River,Forest,Grassland
Network of food chain is:,Food web,Food pyramids,Biomass,Biosphere
Food chain always starts with:,Photosynthesis,Respiration,Decomposition,Uptake of minerals
The biotic component of ecosystem includes:,All,Consumer,Producers,Decomposers
Energy stores in a ecosystem through:,Producers,Decomposers,Herbivores,Carnivore
Ecosystem is concerned with:,Both a and b,Flow of energy,Cylycling of matter,None
The most important factor that determine the number of organisms in a grass land ecosystem is:,Sunlight,The animals,The plants,Oxygen
Insectivorous plants grow in:,Nitrogen deficit soil,Oxygen deficit soil,Hydrogen deficit soil,Phosphate deficient soil
The phenomena in which one species inhibit the growth of another species is called:,Ammensalism,Predation,Parasitism,Commensalism
Cuscuta is :,Total stem parasite,Total root parasite,Partial root parasite,Partial stem parasite
Relationship between two organisms in which one obtain some benefit at the cost of others is:,Parasitism,Predation,Symbiosis,Scavengering
Crocodile-birds association is an example of:,Proto-cooperation,Symbiosis,Commensalism,Parasitism
Velamen tissue is found in:,Epiphytes,Mesophytes,Xerophyte,Hydrophytes
Lianas are example of:,Commensalism,Mutalism,Parsitism,Predation
Roots of higher plants develop mycorrhiza for obtaining:,All,Nitrogen,Sulfate,Phosphate
Mycorrhiza shows:,Symbiosis,Endoparasitism,Decomposers,Ectoparasitism
The association between two organisms in which both benefit:,Mutualism,Commensalism,Proto cooperation,All
The best way to check the soil erosion is:,Afforestation,Study of ecology,Overgrazing,Deforestation
Plants growing on sandy soils are:,Psammophytes,Oxylophytes,Psychrophytes,Lithophytes
Least porous soil is:,Clayey soil,Sandy soil,Loamy soil,Gravelly soil
Water holding capacity of soil depend upon:,Size of its particles,Amount of organic matter,Type of parent rock,Type of oraganisms
Physical and chemical characteristics of soils are studied under:,Edaphic factors,Climatic factors,Biotic factors,Topographic factors
Pedology is the study of:,Soils,Rocks,Crop diseases,Locomotion of animals
Relative humidity is measured by:,Psychrometer,Anemometer,Manometer,Photometer
Water logging is due to:,Excess of water,Scarcity of water,Optimum level of water,All
Transpiration is low in:,High atmospheric humidity,Low atmospheric humidity,Both a and b,None
The instrument used to measure wind and velocity is:,Anemometer,Hydrometer,Photometer,Potometer
Plants growing in average conditions of temperature and moisture are:,Mesophytes,Hygrophytes,Hydrophytes,Epiphytes
The factor related to altitude and steepness of the slopes is:,Topographic factor,Biotic factor,Climatic factor,Edaphic factor
Soil transported by gravity is:,Colluvial soil,Alluvial soil,Galacial soil,Eolian soil
Which has humus and minerals?,Horizon A,Horizon B,Horizon C,Horizon D
Readily available water to the plants is:,Capillary water,Gravitational water,Hygroscopic water,Water vapour
Total water in soil is:,Holard,Chesard,Echard,None
Heliophytes are:,Sun loving plants,Light loving plants,Shade loving plants,All
Sympatric speciation is caused by:,Reproductive isolation,Genetic isolation,Interbreeding,Geographic isolation
Individual of a species which occur in a particular area constitute:,Population,Flora,Fauna,Flora ans Fauna
Area occupied by plants and animals is:,Biosphere,Biota,Biome,Ecotone
Study of interrelationships between organisms dna their environment is:,Ecology,Ecosystem,Ethology,Etiology
Species ecology is:,Autecology,Synecology,Community ecology,Palaeocology
Ecological niche of a species is:,Habitat and specific function,Place of living,Specific function,None
Plant and animals living in a particular area constitute:,Community,Flora and fauna,Ecosystem,Ecology
The transition zone in between two community is called:,Ecotone,Ecotype,Ecads,Niche
Gas being produced by paddy fields and involved in global warming is,Methane,Carbon monoxide,Carbon dioxide,Carbon Tetrachloride
