question,answer,wrong1,wrong2,wrong3
Histologival structure of mammalian and amphibian kidneys differ in the,Distribution of MB,Distribution of blood vessels,Structure of MB,Structure of the potential cover
Malphigian body is present in,Renal cortex,Renal medulla,Adrenal cortex,Adrenal medulla
Which is found in kidney ?,Duct of bertini,Eustachian tube,Duct of rivinus,Duct of wirsung
Urea is mainly excreted by,kidney,Liver,skin,lungs
Malphigian body comprises of,Glomerulus and Bowman's Capsule,Glomerulus,Bowman;s capsule,Glomerulus and Nephron
The ability of organism to maintain constant internal environment despite the external changes is called,Homeostasis,Hemopoeisis,Adaptaion,hemostasis
Kidney of Human embryo is,Metanephric,Mesonephric,Pronephric,Opisthonephric
pH of huamn urine is,7.4,9.8,1.2,3.3
Which of the following is the measure of GFR?,Inulin,Insulin,Fats,Protein
Which of these help in concentration of Urine ?,Vasopressin,ACTH,Pitocin,Parathormone
On prolonged fasting which is released from one's urine ?,Ketone,Fat,Amino acid,Aldehyde
Chemical responsible for increas in blood pressure due to renin action s,Angiotension I,Aldosterone,Angiotensinogen,Angiotensin II
Which part of spperm produces Hyalurodinase ?,Acrosome,Mitochondria,Tail,Head
What is function of acrosome of sperm ?,Penetration,Dissolving,Killing,Reproduction
What is function of acrosome of sperm ?,Penetration,Dissolving,Killing,Reproduction
Which is not related with penis ?,Corpus callosum,Corpus cavernosa,Penile urethra,Epididymis
The condition in which testes donot descend down in scrotum :,Cryptorchdism,Impotency,Virilism,Hirucitism
Leydig cells are found in,Connective tissue of Testes,Ventricles of heart,Ventricles of Brain,Bartholin's Gland
Number of spermatozoa foremd from single primary spermatocytes,2,4,6,8
ICSH is secretd by,Pituitary gland,Testis,Ovary,Thymus
Secondary spermatocytes are formed by divison of,Primary spermatocyte,Spermatogonia,Oogonia,Sperms
Graffian follicle is found in,Ovary of mammal,Ovary of frog,Thyroid,Pituitary
Time taken by spermatogonia to mature into spermatozoa is,64 days,30 days,40 days,24 days
Progestrone which causes further thickening of endometrium for implantation is,Corpus luteum,Graffian follicle,Pituitary gland,Bartholin's Gland
Corpus luteum is formed by,ruptured graffian follicle,Lueinizing cell,germinal cells,non keratinized cell
What is the female counter part of prostate gland in the male ?,Bartholin's Gland,Uterus,Clitoris,Graffian follicle
In rabbit fertilization of ova takes place inside,Fallopian tubes,Uterus,Vaginal,Oviducts
Graffian follicles are found in,Ovary,Testis,Stomach,Spleen
Rete testis in man is part of,Seminiferous tubules,Vasa efferentia,Epididymis,Vas deferences
BGestation period of rabbiot is,1 month,6  month,9 month,12 month
Batholin's gland in female rabbit correspond to which gland of male,Coper's Gland,Prostate Gland,Coagulating glands,Inguinal glands
Which of the following helps in nourishment in sperm ?,Sertoli cells,Leydig cells,Rette cells,Coconut oil
Name the hormone that has no role in mensuration,GH,LH,FSH,TSH
From secondary spermatocyte the resulting formation of spermatids,2,4,6,1
Name the hormone that has no role in mensuration,GH,LH,FSH,TSH
Corpus leuteum is formed in,ovary,Fallopian tubve,Uterus,Urethra
Hormone mainly responsible for ovulation is,Leutinizing hormone ( LH ),FSH,Oxytocin,Mineralocarticoids
Progestrone hormone in Graffian follicle of mammals is produced by the,Zona pellucida,Discus proligens,Membrana,Zona radiata
Corpus albicans in menstural cyclle represent which phase,Secretary Phase,Proliferative phase,Ovulatory phase,Destructive phase
Movement of sperm is done by,Tail,Head,Middle piece,Acrosome
Follicuar phase in human menstural cycle is the stage of,repair and proliferation,Menopause,Lactation,Puberty
Cowper's gland is,Male sex gland,Female sex gland,A kind of endocrine gland,A kind of digestive gland
Bartholin's gland is present in human beings on,Either side near the vaginal opening,At the base of male copulatory organ,Antherior margin of vaginal orifice,Prostatic region of urethra in males
Fertilization of ovum in mammals takes,Fallopian tube,Ovary,Uterus,Vagina
Rete testis in man is a part of,Seminiferous tubules,Vasa efferentia,Epididymis,Vas deferens
The number of foetal membrane in man is,4,5,3,6
Which of the following doesn't involve in secretion ?,Epididymis,Prostate,Seminal vesciles,Copwer's glands
"Th the testis of rabbit ,the hormone secreting cells are",cells of leydig,Spermatogonia,Spermatocyte,germinal epithelial cells
Abdominal testis is found in,Elephant,Bat,Rabbit,Monkey
Which hormone influences the formation of corpus luteum ?,LH,Progestrone,Estrogen,FSG
Which hormone induces spermatogensis ?,FSH,LH,ACTH,Thyroxine
Ovulation takes place at,14th day,2nd day,8th day,1st day
Middle piece of sperm contain,Mitochondria,Centriole,Golgi bodies,Nucleus
Acrosome of sperm is trigeered by,Capacitaiton,Lysin,Fertilizins,Na+gate
Normal sperm of human is,375 million per ejaculation,20 million per ejaculation,80 million per ejaculation,100 million per ejaculation
The immediate cause of induction of ovulation in human female is large plasma surge of,LH,FSH,Progestrone,Estradiol
The estrous cycle is a characterisctics of,human females only,mammalian feamle other than primates,human males,mammalian male other then primates
Sperm moves by,flagellar  movement,Ciliary movement,Pseudopodia movement,cyclosis
Prostate gland is present in,around urethra,on urter,on kidney,on testis
Identical twins are produced by fertilization of,1 ovum by 1 sperm,2 ova by 1 sperm,1 ovum by 2 sperms,2 ova by 2 sperms
Which male and female reproductive organs are homologous ?,Urninary bladder and uterus,Penis and oviduct,Vas differentia and ovary,Penis and clitoris
Which of the folowing secrete the same hormone ?,placenta and ovary,Thyoid and adrenal,testes and adrenal,Hypothalamus and posterior pituitary
Incomplete parthenogensis does not occur in human beings because of,Biparental cross fertilization,Uniparental cross fertilization,Presence of both parthenogensis and cross fertilization,Presence of bot complete parthenogensis and uniparental cross fertilization
The organ of corti in mammals is found in,Cochlear canal,Vestibular canal,Tympanic canal,Ear drum
The organ of corti in mammals is found in,Cochlear canal,Vestibular canal,Tympnaic canal,Ear drum
The optic nerve passes through,Blind spot,Fovea centralis,Choroids plexus,Pharynx
Cristae is present in,Semicircular canal,Vestibule,Cochlea,All
Owl retina contains,Only rods,Both rods and cones,Only cones,None
Pigmented layer of eye is known as,Choroid,Fovea,Sclera,Retina
In Myopia image is formed,Before retina,Beyond retina,At retina,Image is not formed
Ceruminous glands are situated,In external auditory meatus,Around anus,In eye lids,In arm pits
A person who cannot see the near objects clearly is likely to us e,Convex lens,Concave lens,Bifocal lens,Cylindrical lens
Vision of rabbit is,Monocular,Mosaic,Binocular,None
Organ of corti lies inside the,scala media,tympanum,scala vestibuli,scala tympani
Meissner's corpuscles are located in,skin,teeth,nail,hair
Cochlea is mainly responsible for,hearing only,balance only,both balance and hearing,percipation of colour
A man suddenly jerked but he managed to balance his body .What worked there ?,Otoliths,endolymph of semi circular canal,Organs of corti,ear ossicles
Part of his ear balances his position ?,Vestibule,Organ of corti,Cochlea,Tectorial membrane
Total no of ear ossicles in human body ?,6,3,2,1
The sensory receptors present on the surface of skin giving sensation of touch are ?,Meissner's corpuscles,Paccian corpuscles,Krause end bulbs,End bulb of rufin
"Suraj is wearing speactacles having concave lens.When the spectacles are not in use,the image in boy's eyeball is formed:",In front of retina,At the optic disc,Ath the yellow spot,behind retina
Person suffering from nigght blindness lacks,Rhodopsin rods,Rods,Cones,Both rods and cones
Part of ear responsible for hearing is,Cochlea,Sacculus,Utricle,Semicircular canals
Hensen's cell is found in,Ear,Eye,Both,Spleen
"In the eye of rabbbit,the light reaching the retina is refracted",5 times,2 times,3 times,4 times
Which is the correct sequence of transmission of vibrations from the air to the auditory nerve in mammal ?,"Tympanic membrane,ear bones,cochlea","Ear bones,cochlea,Tympanic membrane","Tympanic membrane,cochlea,earbones","cochlea,ear bones,Tympanic membrane"
The focusing of lens is done by,ciliary muscle,Iris,Pupil,Sclera
What are thigmo receptors?,tactile hairs,taste hair,chemoreceptors,none
"A person during old age more than 50 becomes unable to see the object at far distance,the defect of eye is",Presbyopia,Myopia,Hypermetropia,Astigmatism
Eustachian tube connects,Pharynx with middle ear,Middle ear with nose,Middle ear with internal ear,External ear and pharynx
Sensory spot in ampulla is called,Crista,Macula,Otolith,Organ of corti
"In retina,yellow spots contains",Cones only,Rod and cones,Rods only,None
The disease caused by bacteria in the human eye is known as,Glaucoma,Protanopia,Xeropthalmia,Trachoma
Acoustic spot in each ampula of human ear is known as,Crista,Otolith,Organ of corti,Macula
Pigmented related to observe grasses by the herbivore eye is,Chloorolabe,Melanin,Rhodopsin,Erythrolabe
Which one is the dividing layer of the mammalian skin ?,startum malphigi,startum corneum,startum spongisum,startum lucidum
Part of ear concerned with hearing is,Basilar membrane and tectorial membrane,Reisnner's membrane & tectorila membrane,=Reisnner's membrae and basilar membrane,Resinner's membrane and ampulla membrane
What is the function of semi circular canal in our ear ?,balancing,to hearing,trasmits sound wave to internal ear,Both 'a' and 'b'
Endolymph is found in the,Internal ear,Brain,Lymph node,Middle ear
Sound is basically amplified by,"Malleus,incus ,stapes",Pinna,Tympanic membrane,Round window
The most active layer of epidermis that gives new cells is,s.mapighi,startum granulosum,S.corneum,S.lucidium
Vision of compund eye is,Mosaic,Unilocular,Binocular,None
The organ of hearing is,Organ of corti,Semicircular canal,tympanic membrane,oval window
At the apex of cochlea the scala vestibuli and scala tympani communicate with each other through,helicotrema,fenestra ovalis,fenestra rotunda,vestibular aqueduct
Cell sensitive to sound vibrations are found in,Organ of corti,Middle ear,Sacculus,Utriculus
Which cell is used to see colur ?,cone cell,rod cell,corneal cell,iris
The organism having both alternation of generation and alternation  of host is,Liver fluke,Tania solium,Ascaris,Wucheria.Bancrofti
Far sightness greater than 55 years is due to,Presbiopia,Myopia,Hypermetropia,Astigmatism
Meibomian gland is found in,Eye,Ear,Pharynx,Nose
In internal ear sensory patches are situated in,Memranous labyrinth,Cochlea,Stapedial plate,Fenestra ovalis
Merkel's discs and meisnner's corpuscles are found in the,Skin of mammals,Skin of frog,Skin of toad,Skin of rabbit
Which one is the sensory organ of rabbit ?,Jacobson's organ,Statocyst,Osphradium,Johnston's organ
Orra serrota is asscociated with,Retina,Cornea,Sclera,Conjuctiva
The finger prints of the finger tips is due to,Dermal papillae,Startum granulosum,Startum lucidium,Startum germinativum
Tectorial membrane is found in,Ear of mammal,Ear of rog,Eye of mammal,Eye of frog
Organ of corti is present in,Scale media,Scala vestibuli,scale tympani,Middle ear
ROd and cones of Retina is modified form of :,Bipolar neurons,Multipolar neurons,Apolar neurons,Unipolar neurons
Which of the following causes the repolarization of the action potential in a nerve fibre ?,Potassium,Calcium,Magnesium,Sodium
The longest Cranial nerve which supplies the body except head is,Vagus,Occulomotor,Olfactory,Auditory
Pair of cranial nerves in rabbit is,12 pairs,10 pairs,11 pairs,13 pairs
Thermoregulatory centre is located in,Hypothalamus,Optic lobe,Thymus gland,Medulla oblangat
Muscular coordination of mammals is controlled by wich part of the brain ?,Cerebellum,Olfactory lobe,Cerebrum,Medulla
Thermoregulatory centre is found in,hypothalamus,dincephalons,cerebellum,occipital lobe
The purely sensory cranial nerves are,"I,II,VII","I,II,VII","III,IV,VI","I,II,III"
Which of the following organs regulates the body temperature ?,Hypothalamus,Pituitary,Thyroid,Adrenal
Paracoel is found in,Crebrum,Optic lobe,Cerebellum,Medulla oblongata
The movement of voluntary muscle is cordinated by,Cerebellum,Cerebrum,Medulla,Pons
Parasympathetic Nervous system,Increases urinary secretion,Increases heart beat,Dilates pupil,Dilates trachea and bronchi
Vomiting cebtre is at,Medula oblongata,Cerebellum,Cerebrum,Pons
Centre of reflex action is,Spinal cord,Medulla,Cerebrum,Cerebellum
Hunger is under the control of,Hypothllamus,Cerebral hemisphere,Stomach,Spinal cord
The corpus callosum in the brain of rabbit is,Connects two hemisphere of cerebrum,connects the cerebrum and cerebellum,connects two lateral lobes of cerebellum,connects spinal cord and medulla oblangata
"In frog,the 'foramen of monoro'connects the.....................ventricles of the brain.",two lateral and the third,olfactory and the third,third and the optic,optic and the fourth
Adrenaline is,vasoconstrictor,vasodilator,motor,depression
Synapse is a gap between adjacent,nerve cells,muscle fibres,muscle cells,nerve cell and any other cells
Hypothalamus f human brain is meant for,Homeostatic control,Body orientation,muscular co-ordination,smell control
crura cerebri are the nerve bands of,optic lobes,cerebellum,cerebrum,hypothalamus
The part of brain which balances the body is,Cerebellum,cerebrum,Medulla oblanagat,Pons varolli
Which centre is stimulated during increase in body temoerature ?,Anterior hypothalamus,Posterior hypothalamus,Limbic system,Red nucleus
Central unit of nervous sytem is,Neuron,Nephron,Myocyte,RBC
Number of Cranial Nerve in human is,12 pairs,12,9 pairs,31 pairs
The lobe of braiin where visula stimuli are received and analyzed,Occipital,Frontal,Temporal,Parietal
Which one of the following nerve is not sensory ?,Oculomotor,Olfactory,Auditory,Optic
Vagus nerve is a part of,parasympathetic nervous system,CNS,Sympathetic nervous system,Spinal nervous system
Centre of intilligence in brain lies in the,Cerebrum,Dincephalon,Cerebellum,Medulla oblongata
Sodium-pump in human body is related to,Nerve impulsee conduction,Transport of Co2,Dissociation of Hb,Exchange of gases
"In human brain,vision centre is located in",Occipital lobe,Frontol lobe,parietal lobe,Temporal lobe
The longest cranial nerve in rabbit is,Vagus,Occulomotor,Auditory,Trochlear
Which one is not sensory nerve ?,Occulomotor(III),Olfactory(I),Optic (II),Auditory ( VIII)
The resting potential of the membrane of a nerve fibre is,-100to -110 mv,60 to 70 mv,50 to 100 mv,-20 to 30 mv
What is the function of motor nerves ?,Conduction of impulse away from CNS,Conduction of impulse to CNS,Both,None
CNS consists of,brain and spinal cord both,brain only,spinal cord only,brain and automonous system
Olfactory lobe is site for,smell,taste,vision,none of the above
What happens if dorsal root horn of spinal nerve broken due to injury ?,no sensation occurs,No action to stimulus,Sensation occurs,Motor action stops
Which part of nervous system helps in gastri ubtestinal regulation,ANS,CNS,PNS,Endocrine itself
Purely sensory cranial nerve is,Olfactory,Trigeminal,Hypoglossal,Facial
Homeostasis of brain is maintained by,hypothalamus and medulla oblongata,cerebrum and cerebellum,cerebellum and medulla oblongata,pons varolli and medulla oblongata
Which of the following is sensory nerve ?,Olfactory,Vagus,Trigeminal,Glossopharyngeal
Involunatry coordination os muscles is controlled  by,medulla oblongata,cerebellum,cerebrum,optic lobes
The cerebral hemipshseres are joined to mid brain by,foramen of monro,foramen of magendie,formaen of luska,crura cerebri
PNS secrete,Acetylcholine,Adrenaline,Both,Noradrenaline
Nissl's ganule are found in,RNA,DNA,Liver,Lungs
Nerves which supplies heart is,Vagus,Trigeminal,Facial,Glossopharyngeal
No of spinal nerves in rabbit is,37 pairs,31 pairs,32 pairs,38 pairs
Parkinson's disease effects,Brain,Lung,Muscles,Kidney
Innermost covering of brain in man is,Piamater,Duramater,Arachnoid,None
Which of the following cranial nerve in man is both sensory and motor ?,Trigeminal,Optic,Olfactory,Auditory
A gangolion of sensory neurons occurs in,dorsal root of spinal nerve,dorsal horn of spinal cord,ventral root of spinal nerve,dermis of skin spinal nerve
Hunger and thirst are under direct control of,hypothalamus,cerebrum,cerebellum,epithalamus
"Acetylcholine,Adrenaline,Norepinephraine are",has gangolions near the organs,has spinephrine as neurotransmitter,accleration most of the pheripheral organs,all of the above
Conduction velocity is highest in,thick mylenated fibre,thin mylenetaed nerve fibre,non mylienated nerve fibre,Axon than in dendron
Reasoning power is maximum in human die to the development of,Cerebral cortex,Cerebellum,Medulla,cerebrum
Rhino's horn is modification of,Epidermal cell,Mesodermal cell,Matted hair,Odontoblast
Universal blood donor is,O-,AB+,0+,AB-
In bone longitudinal canals are connected by transverse canal called,Volkmann canal,Semicircular canal,Inguinal canal,Bidders canal
Blood coagulation is prevented in bllod bank by adding,Citrate phosphate dextrose,citrate phosphate glycolatee,citrate phosphate taurochlorate,citrate phosphate gluconate
Intercalate disc and brancehd muscles are found in,Cardiac,striated,skeletal,both b and c
Which is largest muscle of human body ?,G.maximus,Sartorius,G.maldius,Jaw muscle
Which is not correct ?,Troponin-fibrous protein,Myosin-contractile protein,Red muscle-myoglobin,RBC-Hb
Smooth muscle fibre are,"Spindle shape,unbrached,involuntary and uninucleated",Branched and involuntary,Multinucleated,"Multinucleated,branched"
Which of the following amino acid acts as blood buffer ?,Histidine,Lysine,Arginine,Gultamine
RBC is formed in adult human by :,Bone marrow,Spleen,Liver,Lymph node
Hair and nails are derivative of,Keratin,Bone,Muscles,Hoofs
Gristle cartilage is found in,Hyaline cartilage,Fibro cartilage,Areolar cartilage,Adipose tissues
Gonads consists of,Cuboidal epithellium,Squamous epithellium,Columnar epithellium,Pseudostartifiedepithellium
Cardiac muscles is,Striated and involuntary,Striated and voluntary,Non-striated and voluntary,Non striated and involuntary
Endothellium is,Selectively permeable,Fully permeable,Non permeable,Elastic in nature
Which of the following haemoglobin doesn't contain iron?,Globin,Billirubin,Billiverdin,Haematin
Different types of tissues in human body,"Nervous,epithelial,connective,muscular","Nervous,fibrous,connective,muscular","Epithelial,connective,skeletal,nervous","Ciliated,connective,muscular,reticular"
Ciliated epithellium is found in,Trachea,Small intestine,Bile duct,Gonads
Smooth muscle fibres are,"Unstriped,unbranched,non striated,uninucleated and involuntary","Unstriped,unbranched,non striated,multi nucleated and involuntary","Unstriped,branched,striated,multi nucleated and voluntary","Unstriped,branched,striated,unimultinucleated and voluntary"
Lymphatic fluid in the body is,Blood minus RBC,Blood minus cells,Blood minus WBC,Plasma minus protein
Which of these liver cells acts as phagocyte ?,Kuffer's cell,Dieter's cell,Hensen cell,Acinar cells
A baby with blood group A cannot belong to parents of which blood group ?,"Husband B,wife O","Husband O,wife AB","Husband A ,wife B","Husband AB,wife A"
Which is the largest type of WBCs?,Monocytes,Acidophils,Lymphocytes,Basophils
Pernicious anaemia is caused due to deficiency of,Cyanocobalamine,Ascorbic acid,Calciferol,Thiamine
Csrbonic anhydrase is found in,Erythrocytes,WBC,Plateltes,Mitochondria
Which of the following squeezes out through capillary in'Diapedesis'?,WBC,RBC,Platelet,Plasma
Clotting of the blood is delayed by,Heparin,Prothrombin,Vitamin K,Calcium
Connective tissue is originated from,Mesoderm,Endoderm,Ectoderm,Ecto-mesoderm
Blood is,Connective tissue,Muscular tissue,Epithelial tissue,Nervosu tissue
Histamine is secretd by,Mast cell,Osteoblast,Fibroblast,Macrophage
Antibodies are principally produced by,Lymohoid tissue,Spleen,Liver,Bone marrow
The membrane that covers the cartilage is known as,Perichondrium,Periosteum,Pericardium,Perineurium
RBC of the mammals surives short time because it lacka,nucleus,ribosomes,mitochondria,golgi bodies
Which of the following tissue protects body from wound and infection ?,reticular tissue,areolar tissue,adipose tissue,lymphatuc tissue
Which of the following tissue protects body from wound and infection ?,reticular tissue,areolar tissue,adipose tissue,lymphatuc tissue
Transitional epitellium is found in,Ureter,Larynx,Vein,Kidney
Keratinized startified squamous epithellium is found in,Epidermis,Trachea,Mouth cavity,Lining of blood vessel
Serum is,Plasma minus Fibrinogen,Plasma,Plasma minus calacium ions,Plasma minus Gamma globulins
Claw of rabbit is a modification of,Epidermis,Dermis,gastrodermis,Keratin
Nissl's body is found in,nerve cells,kidney,liver,pancreas
Nissl's body is found in,nerve cells,kidney,liver,pancreas
Myliean sheath is the covering of,axon of nerve cell,GI Tract,cardiac musclles,skeletal muscles
"Incrornary system,blood clot is dissolved by",fibrinolysin,streptokinase,plasminogen,Urease
Distance between two z discs in a striped muscles fibre is called,sacromere,myomere,hypomere,micromere
A band is crossed by,Heinsons line,Z band,I band,both  a and b
Nucleus is not present in RBC of mammals because,it is degentrated during maturation,doesn't occur from beginning,decrease size of cell,found only in old RBC
"Heparin,an anticogulant is produced by",Liver,Pancreas,RBC,kidney
"Horns,hoof and nails are derives from",Epidermis,Bone,Cartilage,Muscle
"In rabbit,erthyrocytes are",biconcave,biconvex,muscle,epidermis
Large WBC is,Monocyte,Thrombocyte,Plasma cell,Lymohocyte
Neurons have receptors are,One end f sensory,one end of motor,Along the length of neuron,Both ends of relay neuron
Cells of cartilage is,Chondroblast,Osteoblast,Fibroblast,Goblet cell
Non-nucleated RBC is found in,Mammals,Reptiles,Aves,Amphibian
Sphinomyleins are found in,Nerve cell,Ovum,Sperm cell,RBC
Sphinomyleins are found in,Nerve cell,Ovum,Sperm cell,RBC
Which of the following epithellium forms the lining of vessels ?,Tessellated,Cuboidal,Colunar,Trasnitional
Lack of blood supply and presence of the non-cellular basement are the characteristics of the,Epithelial tissue,Muscular tissue,Fluid connective tissue,Nervosu tissue
Haversian canals are present in,Humerus,Sternum,Clavicle,Pubis
Blood is a.....................,Connective tissue,Epithelial tiddue,Adipose tissue,Nervous tissue
Which tisue is known as pavement epithellium ?,Simple squamous epithellium,Columnar epithellium,cubodial epithellium,ciliated epithelium
Which of the following leuckocytes doesn't contain granules in cytoplasm?,Monocyte,Neutrophil,Basophil,Eosinophil
Urniogenital ducts are lined by,Pseudostartified columnar epithellium,Glandular epithellium,Simple squamous epithellium,Startified squamous epithellium
Which of the human cell do not contain mitochondria,RBC,Nerve cells,Liver cells,WBC
A condition when the blood glucose level exceeds its normal value is called,Hyperglycemia,Hypertension,Hyperglycine,Hyperglycosuria
"In human body,which cell has no nucleus",RBC,Nerve cell,Plasma cell,WBC
In which animal tissue lacunae is not present,Areolar cartilage,Elatic cartilage,Hyaline cartilage,Fibrocartlage
Skeleton and muscle originate from,Mesoderm only,Ectoderm and mesoderm,Ectoderm,Endoderm
Which of the following cellular components of the blood is responsible for the production of antibodies?,Lymphocyte,Thrombocyte,Monocyte,Erythrocyte
Which of the following cellular componnets of the blood is responsible for the prudction of antiobodies?,Thrombocytes,Monocytes,Basophils,Neutrophils
Anitobody in the blood is produced by,Lymphocytes,Monocytes,Basophils,Neutrophils
Animal body is protected from wound and infection by,Reticular tissue,Adipose tissue,Lymphatic tissue,Areolar tissue
Theacidophils are,WBC,Connective tissue cells,Bone cells,Cartilage cells
Hyaline cartilage is found in,Trachea,Public symphsis,Pinna,Suprascapula
The cartilage type in the pinna of man is the,Elastic,Hyaline,Fibrous,Calcified
The tissue that protects body from wound and infection is,Reticular tissue,Areolar,Adipose,Lymphatic
The fibrous sheath that connects the bone is called,Ligament,Tendon,Aponeuroses,Periosteum
Mmeory cells are,T & B cells both,T cells only,B cells only,None of these
Yellow bone marrow is found  especially in the medullary cavity of,long bones,spongy bones,short bones,all of these
Ligament joins,bone to bone,bone to muscle,muscle to muscle,none
The cells which do not divide,neuron,musclular,blood cell,bone cell
Tendon connects,bone to muscle,bone to bone,muscle to muscle,bones of cranium
What is the function of blood platelts?,Aid in coagulation of blood,Caryy Hb,Ingest bacteria,transport carbon dioxide
Oxygen is mainly carried by,Erythrocytes,Plasma,Granulocytes,Lymphocytes
Blood is red in colour due to presence of,haemoglobin,erythrocytes,thrmbocytes,leukocytes
Blood contains particles that are,both,+ vely charged,-vely charged,none
Megaloblastic anameia is caused due to deficiency of,Vit B 12,Fe,Vit A,Vit K
Which of the following vitamin has role in the clotting of blood?,K,C,A,All
A blood group that doesnot have any atigen but possess both A and B antibodies is,O,A,B,AB
