question,answer,wrong1,wrong2,wrong3
"The blood cell in frog,which is found in maximum number and acts as scaveneger is",neutrophill,RBC,eosiniophill,platelets
Which protein related to ageing ?,Collagen,Myosin,Actin,Keratin
"Durfing sternous exercise in human body,glucose is converted to",Pyruvic acid,Lactic acid,Maltose,Fructose
Which of the following helps in muscle contraction ?,Ca,Na,Pb,K
The metal present in haemoglobin is,Iron (II) Ion,Iron (I )ion,Iron (III) Ion,Iron(IV )ion
How many haem group are presen tin haemoglobin ?,4,1,2,3
Addiction of cigarratte is mainly due to,Nicotine,Pridoxine,Theophylline,Caffine
Typhoid in human being is caused by:,Salmonella,Retrovirus,Shigella,Vibrio
Which of the following parasite causes Fe deficient anemia?,Hookworm,Pinworm,Round worm,Tapeworm
Chrnoic alcholoism may harm the following part of our body,Peritoneum,Pleura,Pericardium,None
"In most of the chronic carriers, the organisms of typhoid fever persists in:",Billiary tract,Respiratory tract,Urinary tract,Genital tract
Which among the following is at hig risk of getting AIDS?,Hemophiliac,Colur blind,Night Blind,None
Poor nutrition associated with chronic alcoholism that may lead to Wernicke's encephalopathy is due to deficiency of:,Thiamine,Riboflavin,Folic acid,Cyanocobalamine
Which of the following is a sex linked disease?,Color blindness,AIDS,Typhoid,Dysentry
Mycobacterium tuberculosis is also known as:,Koch's bacillus,Hansen disease,Koch-weeks bacillus,MOT
Which disease is also known as Hansen's disease ?,Leprosy,TB,Malaria,Pilaria
Gaucher's disease is a disease of:,Fat metabolism,Protein metabolism,Glucose metabolism,All
From which part Morphine obtained:,Capsule,Stem,Fruit,Root
Cocaine is obtained from:,Erythroxylon,Atropa,Papaver,Cestrum
HIV invades or Major group of clls depleted in AIDS is:,Helper T-cell,B-cell,Memory T-cell,Killer T-cell
Alpha-interferon and Lamivudin is used in the treatment of:,Hepatitis,AIDS,Malaria,Peptic ulcer
Fatty liver syndrome is caused due to:,Alcohol,Antibiotics,Cannabis,Ciagarrete smoking
Cancers arising from connective tissue are called:,Sarcoma,Carcinoma,Lymphoma,Glioma
Barbiturates and benzodiazepams are examples of:,Tranquilizers and sedatives,Stimulants,Narcotics,Hallucinogens
Inflammation of gall bladder:,Cholecystitis,Stomatitis,Cystitis,Salphingitis
Condition in which blood present in urine is:,Haematuria,Alkaptonuria,Anuria,Ketonuria
Hodgkins disease is related to:,Carcinoma of Lymphoid,Epithelial tissue,Pituitary gland,Nervous tissue
Which of the following cause Oral cancer during consumption of cigratte?,Tar,Nicotine,Polycyclic aromatic compound,"24,5-trinitrophenol"
UV rays disintegrate the DNA structure but the cell recovers itself. This process is called:,Photoreactivation,Vernal adaptability,Mutagenesis,Synapsim
The elevated level of the enzyme ...in serum is found particularly in chronic alcoholics:,Glutamic-pyruvate transaminase,Lactate disintegrate,Alkaline phosphate,Gamma glutamyltransferase (gamma GT)
Rifampicin is used to cure:,Tuberculosis,Cancer,AIDS,Hepatitis
Isoniazid is the drug for disease:,Tuberculosis,Leprosy,Typhoid,Encephalitis
Most common helminthic/worm infestation in Nepal is:,Ascariasis,Ancyclostomiasis,Enterobiasis,Truchuriasis
Infective form of Ascariasis is:,Embryonated egg,Rhabditiform larva,Mamillated egg,Unfertilized egg
All are true for Ascariasis except?,Larva emerge from the eggs in the lungs,Infection occurs through contaminated food,They remain in liver for 3-4 days,They remain in the small bowel for rest of the time
Which of the following statement is not true about Ascariasis?,Blood in urine,Obstruction of intestine,Cough,Intestinal ulcer
Which of the following drugs is used in Asciasis?,Piperazine,Metronidazole,Ziduvudine,Niclosamide
"In a stool examination, eggs of worms are found. The egg is bile stained and the egg shell is thick with irregular albuminous coat which is mamillated. The stool may contain:",Ascaris lumbricoide,Trichuristrichuria,Anclycostema duodenale,Enterobius vermicularis
The causative agent of AIDS is:,Retrovirus,Rota virus,Rhabdo virus,Pox virus
Tatto may lead to transmission of:,AIDS,STDs,ARI,Typhoid
HIV is transmitted by all except:,Saliva,Amniotic fluid,Blood,Semen
The seroconversion test for AIDS occurs positive at about:,12 hours,2 weeks,4 weeks,8 weeks
In AIDS patient which one is common:,Tuberculosis,Cryptoccocus,Cytomegalovirus,Histoplasmosis
The incorrect statement about AIDS is:,Person appears well till 2 years of infection,Risk of transmission from mother to fetus is about 30%,Virus affects CD4+ Cells,Confirmatory test is usually the western blot test
PAP smear examination is used in the detection of:,Cervical cancer,Breast cancer,Lung cancer,Oral cavity cancer
"A 17-years old obese girl developed wrinkles in face, armpit and thigh. What could be the probable cause?",Drug abuse,Dieting,Depression,Wrinking
Which of the following is a narcotic?,Morphine,Cetamol,Aspirin,LSD
Which of the following is not a psychotic drug?,Aspirin,LSD,Marijuana,Heroin
Salmonella typhi mainly effects/typhoid is a disease in which there is infection of:,Ileum,Large intestine,Stomach,Duodenum
Alcohol absorption in our body is mainy from:,Stomach,Duodenum,Ileum,Large intestine
A man will die if he drinks more than...ml of pure methanol:,50,150,250,120
Smoking is the causative factor for?,Lung cancer,Liver cancer,Intestinal cancer,Breast cancer
Which disease is alsp called consumption disease?,TB,Beri-beri,Slim disease,Wernicke-korsakoffsyndrome
Which one is best antiseptic for HIV ?,Alchol,Iodine,Savlon,Lugol's iodine
The virus causing cervical cancer is,Huamn papilloma Virus,Herpes-simplex virus,Epstein bar virus,Rhabdo virus
Parkinsons disease affects,Brain,Lung,Muscles,Kidney
World health day is celebrated in,7th April,31st DEC,10th Oct,24th March
World tobacco day is celebrated as,21st Dec,31 st Dec,21st may,31st May
Whuch disease is transmitted by faceo-oral route,Typhoid,AIDS,Tetanus,Elephantasis
Constriction of pupil and lower respiratory rate is controlled by,Morphine and opium,Heroine and morphine,Thalidomide and alcohol,Heroine and nicotine
PEP in HIV refers to,Post exposure prophylaxis,Past exposure prophylaxis,Present exposure prophylaxis,Principle exposure prophylaxis
Zeil-neil test is used  for,Tuberculosis,Typhoid,AIDS,Syphills
Mycolic acid is present in,Typhoid,Cholera,TB,AIDS
Infective stage of lesmania is,Lesmanial,Leptomonas,Cystic,Trophozite
HIV effects,Helper T cells,Beta cells,Memory cells,CD 4+ cells
Metastasis is,Spread of cancerous cell,Growth of cancerous cell,Cancer of connective tissue,Malignat growth of epithellium
Protein synthesized in response to viral attack i,Interferons,Phenols,Alloxans,Phtoalexins
What is the skeletal system?,All the bones in the body and the tissue that connect them,All the bones in the body,All.the muscles and tendons,"All the body´s organs,both soft and hard tissue"
Which of the following statement is incorrect?,Bone serves as a storehouse for various minerals.,Bone is where most blood cells are made.,Bone is a dry and non-living supporting structure.,Bone protects and supports the body and its organs.
Which bone protects the brain?,The cranium,Calcium,The cerebrum,The cerebellum
"Besides the brain, the skull also protects….",The sense organs,The lungs,The diaphragm,The body’s cells
The purpose of the rib cage is to…,Protect the heart and lungs,Protect the stomach,Protect the spinal cord,Provide an object to which the lungs can attach
What makes bones so strong?,Calcium and phosphorous,Silica,Cartilage,Blood and marrow
What is the difference between cartilage and bone?,"Cartilage is rubbery, and bone is firm.","Bone is rubbery, and cartilage is firm.",Bone is a more primitive tissue than cartilage.,"Bone is inside the body, and cartilage is outside."
The hollow space in the middle of bones is filled with …,Bone marrow,Air,Blood,Bone cells
What is a joint?,The place where two bones are joined,A hinge,A ball and socket,The place where tendons are fastened together
The only movable bone of the skull is,Mandible,Maxilla,Temporal bone,Frontal bone
Which of the following bone is not paired?,Vomer,Palatine,Maxilla,Nasal
The smallest bone in human body is,Stapes,Squamotial,Tibia,Atlas
Zygomatic process in mammals is a part of,Maxilla,Temporal,Mandible,Occipital
Cotyloid bone is a part of,Pelvic girdle,Cranium,Olfactory capsule,Pectoral girdle
Which one of the following is correct digital formula for the phalanages of rabbit ?,"2,3,3,3,3","0,2,2,3,3","0,3,3,3,3","2,2,3,3,3"
Number of false ribs in human body is,3 pairss,2 pairs,6 pairs,12 pairs
Sigmoid notch in rabbit is found in,Radio ulna,Tibia fibula,Femur,Humerus
The largest joint of our body is,Knee joint,Hip joint,Shoulder joint,Elbow joint
Neural spine is reduced in,Atlas vertebrae,Thoracic vertebrae,Lumbar vertebrae,Axis vertebrae
Deltoid ridge is found in,Humerus,Femur,Tibia,Ulna
The check bone in rabbit is the,Zygomatic,Lacrimal,Maxilla,Temporal
Which of  the following bone is not included under  axial skeleton ?,Pectoral girdle,Skull,Vertebral column,Ribs
Socket in pelvic girdle in which head of femur articulates is formed by the fusion of,"Illium,ischium and pubis",Ischium and pubis,Illium and pubis,Illium and ischium
Supratrochlear foramen is present in,Humerus,Pectoral girdle,Femur,Pelvic girdle
"In rabbit,yellow bone marrow is found especially in the medullary cavity of",Long bone,Spongy bone,Short bone,All of these
The process found in axis vertebra is,odontoid,Olecranon,Both,None
Parietal bone is found in,Skull,Pectoral girdle,Pelvic girdle,Limb
Obturator foramen of rabbit is found in,Pelvic girdle,Pectoral,Shoulder,Skull
Deltoid ligament is found in,Ankle joint,Shoulder joint,Coracoacromial joint,Elbow joint
Wrist bones are called,Carpal,Metacarpal,Tarsal,Metatarsal
"A man broke his fibula,i.e he brokes his",Leg,Head,Pubis,Jaw
The total number of thoracic vertebrae is human is,12,10,15,37
The number of cervical vertebrae in human is,7,6,8,12
Pisiform bone is related to,Wrist bone,Elbow joint,Ankle joint,Hip joint
Removal of olecranon process from ulna of rabbit will leave,Non functioning of elbow,Better movement of forearm,Better movement of elbow,None
The number of tarsals in the ankle of a rabbit is,6,4,5,9
The joint between Femur and acetabulum is,Ball and socket joint,Pivot joint,Hingle joint,Saddle joint
No of ribs in human is,24,12,38,36
Scientific term for upper jaw bone is,Maxilla,Mandible,Molar,Incisor
Lumbar vertebrae are located in,Abdominal region,Neck region,Thoracic region,Tail region
Socket in pelvic girdle in which head of femur articulates is formed by the fusion of,"Illium,ischium and pubis",Ishium and pubis,Illium and pubis,Illium and ischium
Neural spine is reduced in,Atlas vertebrae,Thoracic vertebrae,Lumbar vertebrae,Axis vertebrae
Broca's area helps in:,Movement of vocal cords and tongue,Beathing and hicupping,Movement of limbs,Understanding the langauge
