question,answer,wrong1,wrong2,wrong3
Polymers are formed by number of monomers. Adipic acid is one of the monomer of,"Nylon-6, 6",Bakelite,Nylon-6,Buna-S
Amino acid is called amphoteric because of,Alkalinity and acidity,Acidic character,Basic character,Salinity
. Baking powder consists of,tartarate,citrate,chlorate,iodate
The mordant in dye containing HSO3 is,Metal hydroxide,Sodium acetate,Cellulose,Tannin
Biuret test is for,Protein,Carbohydrate,Vitamin,None
Bakelite formed by polymerization of.,Formeldehyde,Acetal dehyde,Acetone,Carboxylic acid.
Which one is Anaesthetic?,CHCl3,C2H4,CH3CI,CCl4
Anticancer compound is,Cis [Pt. cl2(NH3)2],Ner [Co (NH2) Cl2,Cis [pt cl2NH3],NaptCl2.
Hydrolysis of sucrose is called,Inversion,Hydration,Saponification,Esterification
Acetyl salicylic acid is used as,Antipyretic,Antibiotic,Antiseptic,Antacid
Natural polymer is,Starch,Bakelite,Polystyrene,Polyvinyl chloride
The very dilute solution of the zinc sulphate is used as,Eye drops,Fertilizer,Germicide,Fungicide
.Alkaline hydrolysis of fats is known as:,Saponification,Acetylation,Esterification,Alkylation
The fibrous dye formed by oxidation is,Vat dye,Mordant dye,Dispersive dye,Azo-dye
Acetylsalicylic acid has:,Antipyretic property,Antiseptic property,Antibiotic property,Antacid property
Nylon - 66 is:,Polymide,Polysterase,Vinyl polymer,Acetic acid
The disaccharide present in milk is:,Lactose,Sucrose,Maltose,Cellobiose
Which of the following cannot form peptide bond,Acetic acid,Aspartic acid,Glutamic acid,Alanine
PVC is formed by the polymerization of,vinyl chloride,allyl chloride,fluoro ethane,ethylene
Amino acids usually exist in the form of zwitter ions. This means that they consist of:,The basic COO group and the acidic NH3+ group,The basic NH2 group and acidic COOH group,The basic NH3 group and the acidic COO group,The positive ammonium [NH4+] group and the amynegative chloride [Cl-] group.
Which of the following can be derived from coal,All,Dyes,Explosives,Medicine
". Which of the following is used as an antiseptic in
soap?",Phenol,Aniline,Salicyaldelyde,Picric acid
"Which of the following forms polymers of Nylon
thread?",polyamide,Polyester,poly vinyl,Polyethene
Hydrolysis of table sugar produces,glucose and fructos,two molecules of glucose,glucose and galactose,glucose and lactose
PVC is a,addition polymer,condensation polymer,copolymer,thermosetting polymer
The protein has which characteristic bond?,Peptide linkage,Glycosidic linkage,Phosphodiester,all of above
Oils and fats are ester of higher fatty acids with,glycerol,glycol,galactose,t-butylacohol
Which one of the following property is not shown,Antiseptic,antipyretic,,Analgesic
Teflon is a,Homopolymer,Co-polymer,Condensation polymer,inorganic polymer
A dye which are applied to the fabric after treating with a metal ion is,mordant dye,azodye,vat dye,nitro dye
Which of the following contains an aldehyde group?,Glucose,fructose,Starch,Cellulose
Which of the following gives maximum energy in metabolic process?,carbohydrate,protein,nucleic acid,lipid
Which of the following gives maximum energy in a metabolic process?,lipid,carbohydrate,protein,nucleic acid
"Hydrolysis of proteins in the presence of enzymes
produces",amino acids,aromatic acids,hydroxy acids,Dicarboxylic acid
Cane sugar on hydrolysis gives:,Glucose and fructose,Fructose and lactose,Glucose and Lactose,Glucose and ribose
Which one of the following is not found in RNA?,Tymine,Adenine,CYTISINE,Guanine
"Presence of peptide bond is the characteristic
feature of",protein,Carbohydrates,Lipid,Nucleic acid
Which of the following bases in purine?,adenine,tymine,uracil,cytosine
"Which of the following monomer is used to
synthesize PVC?",CH2=CHC,CH3CH=CH2,CH2=CH2,C6H5CH=CH2
polyethene is an example of,addition polymer,condensation polymer,thermo-resisting polymer,co-polymer
"A substance which can act both as an analgesic and
antipyretic is",aspirin,quinine,penicillin,morphine
Which one of the following is vat dye?,indigo,malachite green,matius yellow,alizarin
Which of the following properties is not shown by aspirin?,antiseptic,antipyretic,analgesic,anti-inflammatory
Teflon is a polymer of,tetraflouroethene,difluoroethane,monofluoroethane,tetraflouroethane
p-Acetamido- phenol is an,antipyretic,antibiotic,anesthetic,antiseptic
Nylon is a polymer made from:,adipic acid and hexamethylenediamine,chloroprene,ethylene glycol and terephthalic acid,formaldehyde and urea
.Nylon is,Hexamethylene diamine & adipic acid,Caprolactum,poluvinylchloride,Styrene
Which of the following compounds is Antipyretic ?,paracetamol,Sulfadiazine,chloroxylenol,parathion
Which of the following dye is an azodye?,Methyl orange,Phenopthelein,malachite,methylene green
Bakelite formed by the condensation of,Phenol and formaldehyde,Hexamethylene diammine& Adipic acid,Formic acid and Acetaldehye,Hexamethylene diamine and sebacic acid
Polymer of tetrafluoroethylene is,Teflon,PVC,Dacron,Neoprene
Which of the following is an insecticide?,DDT,TNT,TNB,ASPIRIN
Nylon -66 is a,POLYAMIDE,POLYESTER,POLYSTYRENE,POLYETHENE
Nylon - 66 is the polymer of,Hexamethylene diammine& Adipic Acid,Formaldehyde + Phenol,Vinyl choride,ethylene glycol + Adipic Acid
Which of the following compound is aspirin?,acetyl salicylate,methyl salicylate,phenyl salicylate,salicylic acid
Aspirin is formed when acetyl chloride reacts with,O-hydroxybenzoic acid,m-hydroxybenzene,m-hydroxybenzoic acid,P-hydroxybenzoic acid
"The simplest amino acid which doesn't contain
chiral carbon is:",GLYCINE,ALANINE,ISOLEUCINE,LEUCINE
Lactose on hydrolysis gives:,Glucose + galactose,Glucose + glucose,Glucose + fructose,Fructose + galactose
60% H2O2 and Hydrazine is used as:,Rocket propellant,Germicide,Insecticide,Antiseptic
.Bakelite is,HCHO & Phenol,HCHO & Alcohol,HCHO & Acetone,Alcohol & Phenol
The chemical name of paracetamol,4-hydroxy acetamide,2-hydroxy acetamide,P-hydroxy sulphonic acid,P-hydroxy benzoic acid
Caprolactum is the monomer of;,Nylon,Rayon,Eosin,isoprene
The drug commonly employed for treating,Streptomycin,Chloramphenicol,Penicillin,Quinine
Nitrolim is,Ca(CN)2+C,CaCN2+ C,KCl + MgCl,CaCO3+CN2
Simplest amino acid is,Glycine,Tryptophan,Tyrosine,Arginine
The fibre obtained by the condensation of hexamethylene diamine and adipic acid is,nylon 66,dacron,rayon,teflon
What is co-ordination number of EDTA?,6,2,4,10
a-Helical structure of protein is stabilized by,Intra molecular hydrogen bonding,Inter molecular hydrogen bonding,Peptide bond,electrovalent bonding
Simplest amino acid is,Glycine,tryptophan,Leu ine,Arginine
What is the monomer of Teflon?,F2C = CF2,Cl2C = CF2,Cl3C-CF3,I2C = Cl2
.If polypeptide is polymer of amino acid then what is amino acid?,monomer,polymer,amide,peptide
pentose sugar is,arabinose,glocose,fructose,sucrose
Nylon is,polyamide,polyester,terpenes,polyetene
Artificial silk is a,polysaccharide,polyamide,polyster,polysterene
Nicol prism is made up of,Bakellite,Calcite,Diamond,Graphite
Which of the following is used for making red ink?,Eosin,Congo red,Aniline,Metyl red
Peptide bond consists of,CO-NH,CO-NH2,CHO,CN
The number of carbon atom present in formula of,27,25,26,28
Which of the following is non degradable polymer?,Nylon 6,Cellulose,paper,protein
Which of the following is the sweetest chemical?,fructose,Aspartic acid,Thaumatin,monellin
Condensation product of carprolactum is:,nylon 6,nylon66,nylon 60,"nylon 6,10"
The chemical formula of detergent is,ROSOзNa,R-COOH,R-COONa,R-COOK
Fatty acids which must be obtained from diet are called,essential fatty acids,non-essential fatty acids,saturated fatty acids,unsaturated fatty acids
Bakelite is obtained by the condensation of:,formaldehyde and phenol,acetaldehyde and phenol,formaldehyde and acetone,acetone and phenol
The enzyme pepsin hydrolyses:,proteins to amino acids,fats to fatty acids,starch to glucose,nucleotide to nitrogen bases
"""CISPLATIN"" is:","a complex compound used in the treatment of
cancer",an alloy of cesium and platinum,a medicine used in dysentery,a medicine used in diarrhea
Bakelite is:,condensation product of methanal and phenol,condensation product of ether and urea,condensation product of phenol and benzaldehyde,reaction of phenol and ethanol
Detergent has common group,C6H6-OSOзNa,NaOH,R-COONa,R-ONa
.Hard soap contains,Na salt of Fatty acids,K salt of Fatty acids,Long chain fatty acid,Short chain fatty acid
The most matching description for a chemical commonly used in soaps as antiseptic:,The melting and boiling point increase with the increase in size of aryl group,Three contributing structures have both positive and negative charges,Both aldehyde and acid formed from this contain same no. of carbon atoms,Reacts with Mg in dry ether to form Grignard Reagent
All in the group include those used for medicinal purposes:,"Barbituric acid, Para-aminosalicylic acid, Ascorbic acid","Nitric acid, Carbolic, Tartaric acid","Para aminos salicylic acid, Panthenic acid, Carbolic acid","Ascorbic acid, Barbituric acid, Lysergic acid Diathylamine"
"The constituent in IODEX giving IODEX the characteristic smell is derived from an acid and is produced by treating phenol in alcoholic KOH
wiith:",CHCl3,CH3CL,CCL4,CH2CL2
Compounds with alpha carboxylic acid and alpha Amino functional group both attached tetrahedral carbon atom are:,Amino acid,Aldehyde,Ketones,Esters
All are elements in the 4th period required in the amount not exceeding 5gm for maintenance of proper health:,"K, Fe, Zn","Ca, F, Zn","K, Ca, Fe","K, Fe, F"
Which is not a carbohydrate?,haemoglobin,starch,cellulose,glycogen
Which of the following is not polysaccharide?,dextrin,starch,cellulose,none
Detergent has a common group,R-OSOзNa,NaOH,R-COONa,R-ONa
Isoelectric point is the pH at which,Zwitter ion has zero charge.,amino acid becomes acidic,an amino acid becomes basic,Zwitter ion has +ve change
Indigo belongs to the class of,vat dyes,Mordant dye,direct dyes,disperse dyes
Fertility of acidic soil can be increased by treating with,lime,ammonium phosphate,urea,calcium super phosphate
Teflon is a polymer of :,tetrafluoroethene,tetrafluoroethane,tetrafluoromethane,phenol and formaldehyde
Nylon is:,polyamide,polyexster,amide,polystyrene
"Aldehydes and ketones are carbonyl compounds, which of them react with NaBH4 and react with Fehling reagent",Aldehydes only,Ketones only,Neither aldehydes nor ketone,Both aldehyde and ketone
in DNA the complementary bases are:,"adenine and thymine, guanine and cytosine","uracil and adenine, cytosine and guanine","adenine and guanine, thymine and cytosine","adenine and thymine, guanine and uracil"
Terylene is a condensation polymer of ethylene glycol and,Terephthalic acid`,benzoic acid,Phthalic acid,Salicylic acid
P-Acetamido phenol is an,antipyretic,antibiotic,anesthetic,antiseptic
Bakelite is made from phenol and,methanal,ethanal,methnol,CHCL3
Nylons are,POLYAMIDE,POLYESTER,POLYSTRYRENE,BAKELITE
Estimation of saponification value of fats/oils is done with,KOH,NaOH,Esters,I2
Which is used for lowering temperature?,antipyretic,analgesic,antiseptic,antibiotic
"The polymer Teflon is obtained by polymerization
of ........",Tetrafluoroethene,Tetrafluoroethane,Phenol and formaldehyde,Ttrafluoromethane
Which of the following is not a disaccharide?,mannose,lactose,maltose,sucrose
Cane sugar on hydrolysis gives,Glucose and fructose,Glucose and lactose,Glucose and maltose,V
An ester used as medicine is,Methyl salicylate,Ethyl acetate,Methyl acetate,Ethyl benzoate
What is correct about glucose and fructose?,Glucose is aldohexose and fructose is ketohexose,Glucose and fructose are enantiomers,They are anomers,Glucose is ketohexose and fructose is aldohexose
Which of the following is natural dye?,Alizarin,Phenolphthalein,Martius yellow,Malachite green
The drugs used to get relief from pain are called,Analgesics,Antibiotics,Antiseptics,antipyretic
Aspirin is,2 acetoxy benzoic acid,2 acetoxy acetic acid,ethyl ethanoate,"2, 4, 6 trinitrophenol"
Which of the following is used in medicinal purpose ?,Methyl salicylate,etyl acetoacetate,acetic acid,Co polymer
PVC is,addition polymer,condensation polymer,thermosetting plastic,Co polymer
Aspirin is an acetylatron product of,O-hydroxyl benzoic acid,M-hydroxyl benzoic acid,P-dihydroxy benzoic acid,O-dihydroxy benzene
Lipid consists up of:,"Fat, oil and it derivatives",Amino acid derivatives,Polysterene,Carbohydrates
Acetyl salicylic acid acts as,Antipyretic,Antacid,Antibiotic,Antiseptic
