question,answer,wrong1,wrong2,wrong3
Cooking pot is desired to have ... Specific heat capacity and ... Conductivity,"Low, high","High, low","Low, low","High, high"
Hail stones are produced by the,Freezing of rain drops,Freezing of cloud,Freezing of water vapor,None of the above
The common mercury thermometer can be used to measure temperature between,-30°c to 357°c,-30°c to 100°c,0 to 200°c,-30°c to 200°c
Mercury Thermometer cab be used to Measure temperature up to,360°c,100°c,260°c,500°c
High Temperature is measured by,Pyrometer,Mercury Thermometer,Gas Thermometer,Sphygmomanometer
Mercury is used in liquid thermometer bcz it has,Low specific heat and high conductivity,High specific heat and high conductivity,High specific Heat and low conductivity,Low specific Heat and low conductivity
