question,answer,wrong1,wrong2,wrong3
"According to Darwin, organic evolution is due to",Interspecific competition,Competition with closely related species,Reduced feeding efficiency in one species due to the presence of another species,Intraspecific competition
The wings of a bird and the wings of an insects are,Analogous structures,Homologous structures,Phylogenetic structures,None of the above
Which of the following had the smallest brain capacity?,Homo habilis,Homo neanderthalensis,Homo sapiens,Homo erectus
"What is common to a whale, shark and seal?",Convergent evolution,Seasonal migration,Homeothermy,Subcutaneous fat
Industrial melanism is an example of ____,Natural Selection,Mutation,Neo Lamarckism,none
